product_id,crop_category,crop,variety_name,duration_days,season,plant_height,key_traits,pest_disease_tolerance,fruit_grain_quality,yield_indicator,recommended_irrigation,target_problem_fit,target_region,mrp_inr,pack_size,distributor_availability,approved_for_recommendation,image_url,source_url,last_verified_date
SBN001,Field Crop,Soybean,VIGOUR KARISHMA,90-95,Kharif,55-60 cm,Semi-determinate; 5-6 branches; medium seed; 100 seed wt 12-13gm; yellow seed,Tolerant to YMV & Rust,Medium yellow seed,Standard,Rainfed/Irrigated,Standard sowing; YMV/Rust prone areas,"MP, MH, RJ",,30 kg,,Y,https://vigourseeds.in/images/soyabean-1.png,https://vigourseeds.in/soybean.php,2026-04-23
SBN002,Field Crop,Soybean,VIGOUR 11,90-95,Kharif,55-60 cm,Semi-determinate; 4-5 branches; medium seed; 100 seed wt 12-13gm,Tolerant to YMV & Rust,Medium seed,Standard,Rainfed/Irrigated,General-purpose kharif sowing,"MP, MH, RJ",,30 kg,,Y,https://vigourseeds.in/images/soyabean-2.png,https://vigourseeds.in/soybean.php,2026-04-23
SBN003,Field Crop,Soybean,VIGOUR MALVIKA,95-100,Kharif,55-60 cm,"Semi-determinate; 5-6 branches; black hilum, yellow seed; 100 seed wt 12-13gm",Resistant to major insect pest & disease,Premium yellow seed with black hilum,High disease pressure,Rainfed/Irrigated,Areas with heavy pest/disease pressure,"MP, MH, RJ",,30 kg,,Y,https://vigourseeds.in/images/soyabean-3.png,https://vigourseeds.in/soybean.php,2026-04-23
SBN004,Field Crop,Soybean,VIGOUR KRASHIKA,93-95,Kharif,55-65 cm,Semi-determinate; 5-6 branches; medium seed; 100 seed wt 12-13gm,Tolerant to YMV & Rust,Medium seed,Standard,Rainfed/Irrigated,Mid-duration general-purpose,"MP, MH, RJ",,30 kg,,Y,https://vigourseeds.in/images/soyabean-4.jpg,https://vigourseeds.in/soybean.php,2026-04-23
SBN005,Field Crop,Soybean,VIGOUR KARISHMA 999,93-97,Kharif,55-60 cm,"Semi-determinate, semi-erect; pod yellowish brown; no pod shattering",Tolerant to major insect pest & disease,No pod shattering — reduces field loss,High yield,Rainfed/Irrigated,Late harvest / shattering-prone areas,"MP, MH, RJ",,30 kg,,Y,https://vigourseeds.in/images/soyabean-5.png,https://vigourseeds.in/soybean.php,2026-04-23
SBN006,Field Crop,Soybean,VIGOUR 7007,93-97,Kharif,55-60 cm,Determinate; 4-5 branches; bold seed; 100 seed wt 13-14gm,"Resistant to major insect, pest & disease",Bold seed — premium grade,High yield,Rainfed/Irrigated,Quality-conscious / mandi premium areas,"MP, MH, RJ",,30 kg,,Y,https://vigourseeds.in/images/soyabean-6.png,https://vigourseeds.in/soybean.php,2026-04-23
SBN007,Field Crop,Soybean,VIGOUR 444,93-97,Kharif,55-65 cm,Semi-determinate; 4-5 branches; medium seed; 100 seed wt 12-13gm,Standard,Medium seed,Standard,Rainfed/Irrigated,General-purpose,"MP, MH, RJ",,30 kg,,Y,https://vigourseeds.in/images/soyabean-7.jpg,https://vigourseeds.in/soybean.php,2026-04-23
SBN008,Field Crop,Soybean,VIGOUR PRATHVIRAJ,93-97,Kharif,55-60 cm,Semi-determinate; medium tall; four-seeded pods more; wide adaptability,Tolerant to major insect pest & disease,4-seeded pods (higher kernel count),High yield potential,Rainfed/Irrigated,Maximum yield / commercial growers,"MP, MH, RJ",,30 kg,,Y,https://vigourseeds.in/images/soyabean-8.jpg,https://vigourseeds.in/soybean.php,2026-04-23
MZE001,Field Crop,Maize,VIGOUR 60A90,120-125,Kharif & Rabi,Standard,Shelling 84-85%; cob 20-22cm; 40-44 grains/row; medium orange grain; stay green; drought tolerant,Highly tolerant to TLB & stem borer,Medium orange — good fodder also,High yield,Rainfed/Irrigated,Drought / TLB / stem borer prone areas,"MP, RJ, GJ",,4 kg,,Y,https://vigourseeds.in/images/corn-1.png,https://vigourseeds.in/corn.php,2026-04-23
MZE002,Field Crop,Maize,VIGOUR 30A90,115-120,Kharif & Rabi,Semi-erect,Cob 20-22cm; medium orange grain; early maturity; uniform ear size; stay green,Standard,Medium orange grain — good tip filling,High grain weight,Rainfed/Irrigated,Early-maturity slot / double cropping,"MP, RJ, GJ",,4 kg,,Y,https://vigourseeds.in/images/corn-2.png,https://vigourseeds.in/corn.php,2026-04-23
MZE003,Field Crop,Maize,VIGOUR 555 (Maize),145-150,Rabi only,210-225 cm,"Shelling 84-85%; semi-flint, light orange; cylindrical uniform cobs; stay green till harvest",Tolerant to leaf blight & downy mildew,Light orange semi-flint,High grain weight,Irrigated,Long-duration rabi maize,"MP, BR, UP",,4 kg,,Y,https://vigourseeds.in/images/corn-3.png,https://vigourseeds.in/corn.php,2026-04-23
MZE004,Field Crop,Maize,VIGOUR 007,115-120,Kharif & Rabi,Tall,Lodging resistant; orange-yellow grain; long cob; 16-18 rows; 45-48 grains/row,Standard,Attractive orange-yellow grain,High yield,Rainfed/Irrigated,Lodging-prone / windy areas,"MP, RJ, GJ",,4 kg,,Y,https://vigourseeds.in/images/corn-4.png,https://vigourseeds.in/corn.php,2026-04-23
MZE005,Field Crop,Maize,VIGOUR AAMUKTHA,115-120,Kharif & Rabi,Tall,Lodging resistant; orange-yellow grain; long cob; 16-18 rows; 45-48 grains/row,Standard,Attractive orange-yellow grain,High yield,Rainfed/Irrigated,Lodging-prone areas,"AP, TG, KA",,4 kg,,Y,https://vigourseeds.in/images/corn-5.png,https://vigourseeds.in/corn.php,2026-04-23
MZE006,Field Crop,Maize,VIGOUR 50x50,TBD,TBD,TBD,NEEDS R&D INPUT — variety listed on site without spec sheet,TBD,TBD,TBD,TBD,TBD,TBD,,4 kg,,N,https://vigourseeds.in/images/corn-6.png,https://vigourseeds.in/corn.php,2026-04-23
MZE007,Field Crop,Maize,VIGOUR WHITE COBRA,TBD,TBD,TBD,NEEDS R&D INPUT — white grain variety; spec sheet to be confirmed,TBD,White grain,TBD,TBD,White corn / specialty markets,TBD,,4 kg,,N,https://vigourseeds.in/images/corn-7.png,https://vigourseeds.in/corn.php,2026-04-23
PDY001,Field Crop,Paddy,VIGOUR 087,120-125,Kharif,Standard,Effective tillers; high spikelet fertility; fine slender grain; very good cooking,Tolerant to bacterial blight & blast,Fine slender grain; premium cooking,High yield,Irrigated,Premium fine-grain market,"CG, MP, OD",,20 kg,,Y,https://vigourseeds.in/images/paddy-1.png,https://vigourseeds.in/paddy.php,2026-04-23
PDY002,Field Crop,Paddy,VIGOUR BAJIRAO,115-120,Kharif & Rabi,95-105 cm,Panicle 26-28 cm; bold long cylindrical grain; high yield capacity,Standard,Bold long cylindrical,High yield,Irrigated,Volume / commodity grain market,"CG, MP, OD",,20 kg,,Y,https://vigourseeds.in/images/paddy-2.png,https://vigourseeds.in/paddy.php,2026-04-23
PDY003,Field Crop,Paddy,VIGOUR SONIYA,135-145,Kharif,Standard,Effective tillers; high spikelet fertility; coarse grain; very good cooking,Tolerant to bacterial blight & blast,Coarse grain,Standard,Irrigated,Long-duration coarse grain belts,"CG, OD, BR",,20 kg,,Y,https://vigourseeds.in/images/paddy-3.png,https://vigourseeds.in/paddy.php,2026-04-23
PDY004,Field Crop,Paddy,VIGOUR CHANCHAL,115-120,Kharif & Rabi,90-100 cm,Panicle 25-27 cm; bold grain; high yield,Tolerant to BLB & sucking pest,Bold grain,High yield,Irrigated,BLB / sucking pest prone,"CG, MP, OD",,20 kg,,Y,https://vigourseeds.in/images/paddy-4.png,https://vigourseeds.in/paddy.php,2026-04-23
PDY005,Field Crop,Paddy,VIGOUR 001,115-120,Kharif,Standard,Effective tillers; super fine short slender grain; very good cooking,Tolerant to bacterial blight & blast,Super fine short slender — premium,Standard,Irrigated,Premium fine-grain export-style,"CG, MP, OD",,20 kg,,Y,https://vigourseeds.in/images/paddy-5.png,https://vigourseeds.in/paddy.php,2026-04-23
PDY006,Field Crop,Paddy,VIGOUR DIAMOND 555,130-135,Kharif,95-105 cm,Extra long cylindrical grain; panicle 24-26cm; high yield; excellent cooking,Tolerant to bacterial blight & blast,Extra long cylindrical — premium basmati-style,High yield,Irrigated,Long-grain premium market,"CG, MP, OD, UP",,20 kg,,Y,https://vigourseeds.in/images/paddy-6.png,https://vigourseeds.in/paddy.php,2026-04-23
PDY007,Field Crop,Paddy,VIGOUR 999 (Paddy),115-120,Kharif,Standard,Effective tillers; coarse grain; very good cooking,Tolerant to bacterial blight & blast,Coarse grain,Standard,Irrigated,Coarse grain volume market,"CG, OD, BR",,20 kg,,Y,https://vigourseeds.in/images/paddy-7.png,https://vigourseeds.in/paddy.php,2026-04-23
PDY008,Field Crop,Paddy,VIGOUR MASTANI,135-140,Kharif,110-115 cm,High spikelet fertility; short bold grain; high yield,Tolerant to bacterial blight & sucking pest,Short bold grain,High yield,Irrigated,BLB / sucking pest prone long-duration belts,"CG, MP",,20 kg,,Y,https://vigourseeds.in/images/paddy-8.png,https://vigourseeds.in/paddy.php,2026-04-23
PDY009,Field Crop,Paddy,VIGOUR LAVANYA,135-145,Kharif,90-100 cm,Extra super fine grain; non-lodging; high yield; excellent cooking,Tolerant to bacterial leaf blight & sucking pest,Extra super fine — premium,High yield,Irrigated,Non-lodging premium fine-grain,"CG, MP, OD",,20 kg,,Y,https://vigourseeds.in/images/paddy-9.png,https://vigourseeds.in/paddy.php,2026-04-23
PDY010,Field Crop,Paddy,VIGOUR PB-1692,TBD,TBD,TBD,NEEDS R&D INPUT — Pusa Basmati lineage variant; specs to be confirmed,TBD,TBD (likely basmati-style),TBD,Irrigated,Basmati belts,"PB, HR, UP",,20 kg,,N,https://vigourseeds.in/images/paddy-10.png,https://vigourseeds.in/paddy.php,2026-04-23
PDY011,Field Crop,Paddy,VIGOUR BANSI-115,TBD,TBD,TBD,NEEDS R&D INPUT,TBD,TBD,TBD,Irrigated,TBD,TBD,,20 kg,,N,https://vigourseeds.in/images/paddy-11.png,https://vigourseeds.in/paddy.php,2026-04-23
PDY012,Field Crop,Paddy,VIGOUR BANSI-151,TBD,TBD,TBD,NEEDS R&D INPUT,TBD,TBD,TBD,Irrigated,TBD,TBD,,20 kg,,N,https://vigourseeds.in/images/paddy-12.png,https://vigourseeds.in/paddy.php,2026-04-23
PDY013,Field Crop,Paddy,VIGOUR LAQSHYA,TBD,TBD,TBD,NEEDS R&D INPUT,TBD,TBD,TBD,Irrigated,TBD,TBD,,20 kg,,N,https://vigourseeds.in/images/paddy-13.png,https://vigourseeds.in/paddy.php,2026-04-23
PDY014,Field Crop,Paddy,VIGOUR PB-1885,TBD,TBD,TBD,NEEDS R&D INPUT — Pusa Basmati lineage variant,TBD,TBD,TBD,Irrigated,Basmati belts,"PB, HR, UP",,20 kg,,N,https://vigourseeds.in/images/paddy-14.png,https://vigourseeds.in/paddy.php,2026-04-23
PDY015,Field Crop,Paddy,VIGOUR PB-1718,TBD,TBD,TBD,NEEDS R&D INPUT — Pusa Basmati lineage variant,TBD,TBD,TBD,Irrigated,Basmati belts,"PB, HR, UP",,20 kg,,N,https://vigourseeds.in/images/paddy-15.png,https://vigourseeds.in/paddy.php,2026-04-23
PDY016,Field Crop,Paddy,VIGOUR SHEHANSHAH,TBD,TBD,TBD,NEEDS R&D INPUT,TBD,TBD,TBD,Irrigated,TBD,TBD,,20 kg,,N,https://vigourseeds.in/images/paddy-16.png,https://vigourseeds.in/paddy.php,2026-04-23
PDY017,Field Crop,Paddy,VIGOUR YAMA-51,TBD,TBD,TBD,NEEDS R&D INPUT,TBD,TBD,TBD,Irrigated,TBD,TBD,,20 kg,,N,https://vigourseeds.in/images/paddy-17.png,https://vigourseeds.in/paddy.php,2026-04-23
WHT001,Field Crop,Wheat,VIGOUR 111,110-115,Rabi,"Medium tall, erect",Excellent yield & tillering; soft chapati quality; bold ambar seed; long straight spikelet,"Tolerant to insect, pest & disease",Soft tasty chapati; bold ambar grain,Excellent yield,Irrigated,Quality-focused chapati segment,"MP, UP, RJ",,40 kg,,Y,https://vigourseeds.in/images/wheat-1.png,https://vigourseeds.in/wheat.php,2026-04-23
WHT002,Field Crop,Wheat,VIGOUR 777,Standard,Rabi,"Tall, semi-erect",Long spikelet; good yield & tillering; tasty chapati; bold ambar seed,Tolerant to Karnal bunt & smut,Bold ambar grain — chapati quality,Good yield,Irrigated,Karnal bunt / smut prone areas,"MP, UP, PB, HR",,40 kg,,Y,https://vigourseeds.in/images/wheat-2.png,https://vigourseeds.in/wheat.php,2026-04-23
WHT003,Field Crop,Wheat,VIGOUR 555 (Wheat),110-115,Rabi,"Medium tall, erect",Excellent yield & tillering; bold ambar seed,"Tolerant to major insect, pest & disease",Bold ambar grain,Excellent yield,Irrigated,Standard rabi wheat zones,"MP, UP, RJ",,40 kg,,Y,https://vigourseeds.in/images/wheat-3.jpg,https://vigourseeds.in/wheat.php,2026-04-23
WHT004,Field Crop,Wheat,VIGOUR MILKHA 159,TBD,Rabi,TBD,NEEDS R&D INPUT — variety listed on site without spec sheet,TBD,TBD,TBD,Irrigated,TBD,TBD,,40 kg,,N,https://vigourseeds.in/images/wheat-4.png,https://vigourseeds.in/wheat.php,2026-04-23
GRM001,Field Crop,Tur (Arhar),VIGOUR RAMYA,150-160,Kharif,170-180 cm,Spreading plant; long fruiting branches; red grain; 4-5 grains/pod; excellent dal & cooking,Tolerant to wilting disease,Red grain; premium dal,Standard,Rainfed/Irrigated,Wilt-prone tur belts,"MH, KA, MP",,5 kg,,Y,https://vigourseeds.in/images/gram-1.png,https://vigourseeds.in/gram.php,2026-04-23
GRM002,Field Crop,Green Gram (Moong),VIGOUR GREEN PARI,60-65,Kharif/Summer,50-60 cm,Shiny green bold glossy grain; 12-14 grains/pod; non-shattering; more pods/cluster,Highly tolerant to powdery mildew & YVM,Shiny green bold — premium grade,High yield,Rainfed/Irrigated,Short-duration moong / catch crop,"MP, RJ, MH",,4 kg,,Y,https://vigourseeds.in/images/gram-2.png,https://vigourseeds.in/gram.php,2026-04-23
GRM003,Field Crop,Chickpea (Chana),VIGOUR MAHANKAL,100-105,Rabi,Semi-erect,Early variety; 1-2 seeded pods; 100 seed wt 25-28gm; drought resistant; widely adopted,Tolerant to wilt & pod borer,Bold seed,Good yield,Rainfed,Drought-prone / wilt-prone chana belts,"MP, RJ, MH, KA",,5 kg,,Y,https://vigourseeds.in/images/gram-3.png,https://vigourseeds.in/gram.php,2026-04-23
GRM004,Field Crop,Green Gram (Moong),VIGOUR MAHALAXMI,100-110,Kharif/Summer,50-60 cm,Determinate semi-spreading; shiny green bold glossy; 12-16 grains/branch; more pods/cluster,Highly tolerant to wilting disease,Shiny green bold,Standard,Rainfed/Irrigated,Long-duration moong / wilt-prone areas,"MP, RJ, MH",,4 kg,,Y,https://vigourseeds.in/images/gram-4.jpg,https://vigourseeds.in/gram.php,2026-04-23
GRM005,Field Crop,Chickpea (Chana),VIGOUR MAHAGOURI,95-100,Rabi,Semi-erect,Early variety; medium bold seed; 100 seed wt 23-26gm; drought resistant; widely adopted,"Tolerant to wilt, pod borer & cut worm",Medium bold seed,Good yield,Rainfed,Early-maturity chana / drought-prone,"MP, RJ, MH, KA",,5 kg,,Y,https://vigourseeds.in/images/gram-5.jpg,https://vigourseeds.in/gram.php,2026-04-23
GRM006,Field Crop,Black Gram (Urad),KAJAL BLACK GRAM,TBD,Kharif/Summer,TBD,"NEEDS R&D INPUT — black gram variety, specs to be confirmed",TBD,Black grain,TBD,Rainfed,Urad belts,TBD,,4 kg,,N,https://vigourseeds.in/images/gram-6.png,https://vigourseeds.in/gram.php,2026-04-23
MST001,Field Crop,Mustard,VIGOUR 2311,105-110,Rabi,Standard,Early maturing; oil content 40-42%; 1000 seed wt 4.0-4.5gm; potential yield,"Tolerant to major insect, pest & disease",High oil content (40-42%),Potential yield,Rainfed/Irrigated,Early-maturity oilseed slot,"RJ, MP, HR",,5 kg,,Y,https://vigourseeds.in/images/mustard-1.png,https://vigourseeds.in/mustard.php,2026-04-23
MST002,Field Crop,Mustard,VIGOUR 916,Standard,Rabi,Standard,1000 seed wt 4.5-5.0gm; medium bold round seed; oil content 38-40%; early maturing,"Tolerant to insect, pest & disease",Medium bold round seed; 38-40% oil,Good yield (rainfed & irrigated),Rainfed/Irrigated,Both rainfed & irrigated mustard zones,"RJ, MP, HR",,5 kg,,Y,https://vigourseeds.in/images/mustard-2.png,https://vigourseeds.in/mustard.php,2026-04-23
MST003,Field Crop,Mustard,VIGOUR 4010,TBD,Rabi,TBD,NEEDS R&D INPUT,TBD,TBD,TBD,Rainfed/Irrigated,TBD,TBD,,5 kg,,N,https://vigourseeds.in/images/mustard-3.png,https://vigourseeds.in/mustard.php,2026-04-23
BJR001,Field Crop,Bajra (Pearl Millet),VIGOUR VANSHIKA,Standard,Kharif & Rabi,6-8 ft,Early maturity; vigorous growth; shiny ash gray bold grain; broad dark green leaves; non-lodging; stay green fodder,Standard,Shiny ash gray bold grain + good fodder,Standard,Rainfed,Dual-purpose grain + fodder,"RJ, GJ, MH, MP",,1.5 kg,,Y,https://vigourseeds.in/images/millet-2.png,https://vigourseeds.in/bajra.php,2026-04-23
BJR002,Field Crop,Bajra (Pearl Millet),VIGOUR SINGHAM,80-85,Kharif,7-8 ft,Medium height non-lodging; non-bristled compact long earhead; bold grain; stay green fodder,Tolerant to downy mildew,Bold grain + fodder,Good yield,Rainfed,Downy mildew prone areas,"RJ, GJ, MH",,1.5 kg,,Y,https://vigourseeds.in/images/millet-1.png,https://vigourseeds.in/bajra.php,2026-04-23
OKR001,Vegetable,Okra,VIGOUR 69,45-50 (1st harvest),Kharif/Summer,"Dwarf, short internode",Dark green tender straight fruit; easy picking; high yield; crispy uniform fruit,Tolerant to YVMV & OLCV,Dark green tender straight; crispy,High yield,Irrigated,YVMV / OLCV prone okra belts,"MP, UP, MH, GJ",,500 g,,Y,https://vigourseeds.in/images/okara-1.png,https://vigourseeds.in/okra.php,2026-04-23
OKR002,Vegetable,Okra,VIGOUR 10,45-50 (1st harvest),Kharif/Summer,Medium tall,Dark green tender straight fruit; easy picking; high yield; crispy uniform,Tolerant to YVMV & OLCV,Dark green tender straight,High yield,Irrigated,Standard okra zones,"MP, UP, MH, GJ",,500 g,,Y,https://vigourseeds.in/images/okara-2.jpg,https://vigourseeds.in/okra.php,2026-04-23
OKR003,Vegetable,Okra,VIGOUR DIVYA,47-51 (1st harvest),Kharif/Summer,Medium tall,Dark uniform green tender straight; easy picking; high yield; crispy uniform,Highly tolerant to YVMV & OLCV,Dark uniform green,High yield,Irrigated,Heavy YVMV / OLCV pressure areas,"MP, UP, MH, GJ",,500 g,,Y,https://vigourseeds.in/images/okara-3.jpg,https://vigourseeds.in/okra.php,2026-04-23
TOM001,Vegetable,Tomato,VIGOUR 77,65-70 (1st harvest),Kharif/Rabi,Semi-determinate,"Semi round, acidic desi segment; deep red uniform; fruit 85-90gm; good for distant markets","Tolerant to ToLCV, EB, LB",Deep red uniform; firm,Good yield,Irrigated,Long-distance transport markets,"MP, MH, KA",,10 g,,Y,https://vigourseeds.in/images/tomato-1.jpg,https://vigourseeds.in/tomato.php,2026-04-23
TOM002,Vegetable,Tomato,VIGOUR 99,65-70 (1st harvest),Kharif/Rabi,Semi-determinate vigorous,Round dark red with green shoulder; firm; fruit 90-100gm; excellent rejuvenation,"Tolerant to ToLCV, EB, LB",Round dark red; firm,Good yield,Irrigated,Disease-prone areas + distant markets,"MP, MH, KA",,10 g,,Y,https://vigourseeds.in/images/tomato-2.jpg,https://vigourseeds.in/tomato.php,2026-04-23
TOM003,Vegetable,Tomato,VIGOUR MAMTA,65-70 (1st harvest),Kharif/Rabi,Semi-determinate vigorous,Desi type; flat round red with green shoulder; fruit 70-90gm,"Tolerant to ToLCV, EB, LB",Flat round red — desi segment,Standard,Irrigated,Local desi markets,"MP, RJ, UP",,10 g,,Y,https://vigourseeds.in/images/tomato-3.jpg,https://vigourseeds.in/tomato.php,2026-04-23
TOM004,Vegetable,Tomato,VIGOUR DEEPAK,65-70 (1st harvest),Kharif/Rabi,Semi-determinate vigorous,Oval uniform deep red; excellent keeping quality; fruit 90-110gm; profuse bearing,"Tolerant to ToLCV, Early blight",Oval uniform deep red — excellent shelf life,High yield potential,Irrigated,Premium / longer shelf-life markets,"MP, MH, KA",,10 g,,Y,https://vigourseeds.in/images/tomato-4.jpg,https://vigourseeds.in/tomato.php,2026-04-23
TOM005,Vegetable,Tomato,VIGOUR VERSHA,65-70 (1st harvest),Kharif/Rabi,Semi-determinate,Square round dark red; fruit 100-110gm; high yielding hybrid; long transport quality,"Tolerant to ToLCV, EB, LB",Square round dark red — premium grade,High yielding,Irrigated,Long transport / export-style,"MP, MH, KA",,10 g,,Y,https://vigourseeds.in/images/tomato-5.jpg,https://vigourseeds.in/tomato.php,2026-04-23
HPP001,Vegetable,Hot Pepper (Chilli),VIGOUR UJWALA,Standard,Kharif/Rabi,"Medium tall, dense canopy",Short thin fruits 12-15cm × 0.8-0.9cm; parrot green medium pungent; fresh purpose,Tolerant to sucking pests & virus,Parrot green medium pungent,High yield capacity,Irrigated,Fresh green chilli market,"AP, TG, KA, MH",,10 g,,Y,https://vigourseeds.in/images/pepper-1.jpg,https://vigourseeds.in/hot-pepper.php,2026-04-23
HPP002,Vegetable,Hot Pepper (Chilli),VIGOUR SHIKHA,Standard,Kharif/Rabi,Tall spreading,Parrot green; medium long shiny wrinkled; 14-15cm × 1.2-1.4cm; medium pungent,Tolerant to sucking pest,Parrot green wrinkled — premium fresh,Excellent yield,Irrigated,Fresh chilli premium segment,"AP, TG, KA, MH",,10 g,,Y,https://vigourseeds.in/images/pepper-2.jpg,https://vigourseeds.in/hot-pepper.php,2026-04-23
HPP003,Vegetable,Hot Pepper (Chilli),VIGOUR KIRTI,Standard,Kharif/Rabi,"Medium tall, dense canopy",14-16cm × 1.5-2.0cm; long bhajji segment; less pungent; excellent keeping,Tolerant to sucking pests & virus,Long bhajji segment,High yielding,Irrigated,Bhajji / mirchi pakora segment,"MP, MH, GJ",,10 g,,Y,https://vigourseeds.in/images/pepper-3.jpg,https://vigourseeds.in/hot-pepper.php,2026-04-23
HPP004,Vegetable,Hot Pepper (Chilli),VIGOUR VK 47,Standard,Kharif/Rabi,"Medium tall, dense canopy",Short thin 7-8cm × 0.8-0.9cm; dark red high pungent; red powder retention,Tolerant to sucking pest & virus,Dark red high pungent,Standard,Irrigated,Red dry chilli / powder market,"AP, TG, KA",,10 g,,Y,https://vigourseeds.in/images/pepper-4.png,https://vigourseeds.in/hot-pepper.php,2026-04-23
HPP005,Vegetable,Hot Pepper (Chilli),VIGOUR GADAR,Standard,Kharif/Rabi,"Medium tall, dense canopy",Short thin 8-10cm × 0.8-0.9cm; dark red high pungent; red powder retention,Highly tolerant to sucking pests & virus,Dark red high pungent,Standard,Irrigated,Red dry chilli + virus-prone areas,"AP, TG, KA",,10 g,,Y,https://vigourseeds.in/images/pepper-5.jpg,https://vigourseeds.in/hot-pepper.php,2026-04-23
HPP006,Vegetable,Hot Pepper (Chilli),VIGOUR 90-90,Standard,Kharif/Rabi,Tall semi-spreading,Short thin 7-8cm × 0.8-0.9cm; dark red high pungent; red powder retention,Excellent tolerant to sucking pest,Dark red high pungent,Standard,Irrigated,Red dry chilli premium,"AP, TG, KA",,10 g,,Y,https://vigourseeds.in/images/pepper-6.jpg,https://vigourseeds.in/hot-pepper.php,2026-04-23
HPP007,Vegetable,Hot Pepper (Chilli),VIGOUR VK 56,Standard,Kharif/Rabi,Tall vigorous,Medium green; medium long smooth glossy 11-12cm × 1.2-1.4cm; high pungent,Tolerant to sucking pest,Medium green smooth glossy,High dry fruit weight,Irrigated,Red dry purpose,"AP, TG, KA",,10 g,,Y,https://vigourseeds.in/images/pepper-7.jpg,https://vigourseeds.in/hot-pepper.php,2026-04-23
HPP008,Vegetable,Hot Pepper (Chilli),VIGOUR 2000,Standard,Kharif/Rabi,Tall vigorous,Shiny green thick tapering bullet type; 6-7cm × 2-3cm; medium pungent,Tolerant to sucking pest,Bullet type shiny green,Standard,Irrigated,Bullet chilli market,"MH, KA, MP",,10 g,,Y,https://vigourseeds.in/images/pepper-8.png,https://vigourseeds.in/hot-pepper.php,2026-04-23
HPP009,Vegetable,Hot Pepper (Chilli),VIGOUR NAVIKA,Standard,Kharif/Rabi,Medium tall semi-spreading,Shiny green smooth glossy upright; 6-7cm × 0.8-0.9cm; high pungent; excellent red dry,Tolerant to sucking pest,Shiny green smooth glossy upright,Very high yield,Irrigated,Dual green + red dry market,"AP, TG, KA, MH",,10 g,,Y,https://vigourseeds.in/images/pepper-9.jpg,https://vigourseeds.in/hot-pepper.php,2026-04-23
HPP010,Vegetable,Hot Pepper (Chilli),VIGOUR SHOURYA,Standard,Kharif/Rabi,Medium tall semi-spreading,Purplish glossy; 7-8cm × 0.8-0.9cm; high pungent; excellent green & red dry,Tolerant to sucking pest,Purplish glossy — distinctive,Very high yield in segment,Irrigated,Specialty purplish chilli markets,"AP, TG, KA",,10 g,,Y,https://vigourseeds.in/images/pepper-10.jpg,https://vigourseeds.in/hot-pepper.php,2026-04-23
WTM001,Vegetable,Watermelon,VIGOUR 501,85-90,Summer,Vigorous vines,Jubilee segment; big oblong shiny 10-12kg; dark red crispy 11-12% TSS; export type,Standard,Big oblong shiny — export grade,High yield,Irrigated,Export & long-transport market,"AP, TN, MH, GJ",,50 g,,Y,https://vigourseeds.in/images/water-1.png,https://vigourseeds.in/watermelon.php,2026-04-23
WTM002,Vegetable,Watermelon,VIGOUR 701,65-70,Summer,Vigorous vines,Ice-box segment; big oval shiny 4-7kg; dark red crispy 12-13% TSS; small seed,Standard,Ice-box small format — premium retail,Standard,Irrigated,Modern retail / ice-box segment,"MH, KA, GJ",,50 g,,Y,https://vigourseeds.in/images/water-2.png,https://vigourseeds.in/watermelon.php,2026-04-23
WTM003,Vegetable,Watermelon,VIGOUR DHEERAJ,70-75 (1st harvest),Summer,Spreading,Red firm sweet flesh; avg 5-7kg; sweetness 12 brix; good fruit setting,Standard,Red firm sweet — good local market,Standard,Irrigated,Local market early harvest,"MP, MH, GJ",,50 g,,Y,https://vigourseeds.in/images/water-3.png,https://vigourseeds.in/watermelon.php,2026-04-23
WTM004,Vegetable,Watermelon,VIGOUR GAJRAJ,75-80,Summer,Vigorous vines,Black skin round 7-8kg; dark red crispy 11-12% TSS; export & keeping quality,Standard,Black skin round — premium export,High yield,Irrigated,Export & premium retail,"AP, MH, GJ",,50 g,,Y,https://vigourseeds.in/images/water-4.jpg,https://vigourseeds.in/watermelon.php,2026-04-23
WTM005,Vegetable,Watermelon,VIGOUR BHIMA,75-80,Summer,Healthy vines,Crimson sweet type; 8-12kg; dark red crispy 11-12% TSS; export purpose,Standard,Crimson sweet — large format export,High yield,Irrigated,Bulk export market,"AP, MH, GJ",,50 g,,Y,https://vigourseeds.in/images/water-5.jpg,https://vigourseeds.in/watermelon.php,2026-04-23
SNF001,Field Crop,Sunflower,TBD,TBD,TBD,TBD,POPULATE FROM CLIENT CATALOG / vigourseeds.in/sunflower.php,TBD,TBD,TBD,TBD,TBD,TBD,,TBD,,N,,https://vigourseeds.in/sunflower.php,2026-04-23
SOR001,Field Crop,Sorghum (Jowar),TBD,TBD,TBD,TBD,POPULATE FROM CLIENT CATALOG / vigourseeds.in/sorghum.php,TBD,TBD,TBD,TBD,TBD,TBD,,TBD,,N,,https://vigourseeds.in/sorghum.php,2026-04-23
CMN001,Field Crop,Cumin/Sesame,TBD,TBD,TBD,TBD,POPULATE FROM CLIENT CATALOG / vigourseeds.in/cumin-sesame.php,TBD,TBD,TBD,TBD,TBD,TBD,,TBD,,N,,https://vigourseeds.in/cumin-sesame.php,2026-04-23
BRJ001,Vegetable,Brinjal,TBD,TBD,TBD,TBD,POPULATE FROM CLIENT CATALOG / vigourseeds.in/brinjal.php,TBD,TBD,TBD,TBD,TBD,TBD,,TBD,,N,,https://vigourseeds.in/brinjal.php,2026-04-23
BTG001,Vegetable,Bitter Gourd,TBD,TBD,TBD,TBD,POPULATE FROM CLIENT CATALOG / vigourseeds.in/bitter-gourd.php,TBD,TBD,TBD,TBD,TBD,TBD,,TBD,,N,,https://vigourseeds.in/bitter-gourd.php,2026-04-23
BLG001,Vegetable,Bottle Gourd,TBD,TBD,TBD,TBD,POPULATE FROM CLIENT CATALOG / vigourseeds.in/bottle-gourd.php,TBD,TBD,TBD,TBD,TBD,TBD,,TBD,,N,,https://vigourseeds.in/bottle-gourd.php,2026-04-23
